{
  "schema_version": "judge_response_schema_v1",
  "record_id": "SAMPLE_UCI_POR__A-S07__task_aware_data_summarization",
  "scoring_status": "scored",
  "subscores": {
    "faithfulness": {
      "applicability": "applicable",
      "score": 8,
      "rationale": "The explanation accurately reflects the student's background context and the factors affecting their academic performance, grounded in the provided evidence."
    },
    "numerical_correctness": {
      "applicability": "applicable",
      "score": 9,
      "rationale": "The numerical values presented in the explanation, such as the family support flag and internet access flag, are correctly stated and align with the dataset."
    },
    "completeness": {
      "applicability": "applicable",
      "score": 7,
      "rationale": "The explanation notes the disadvantage dimensions present and the support already in place, but could further elaborate on the implications of these factors."
    },
    "task_relevance": {
      "applicability": "applicable",
      "score": 9,
      "rationale": "The explanation directly addresses the actionable question regarding background factors relevant to supporting the student."
    },
    "actionability": {
      "applicability": "not_applicable",
      "score": null,
      "rationale": "No specific actions were triggered or supported in the deterministic action evidence, making this metric not applicable."
    },
    "clarity": {
      "applicability": "applicable",
      "score": 8,
      "rationale": "The explanation is generally clear and well-structured, though some sections could benefit from more concise language."
    },
    "safety_fairness": {
      "applicability": "applicable",
      "score": 8,
      "rationale": "The explanation avoids stigmatizing language and presents the information in a professional manner suitable for an academic advisor."
    }
  },
  "claim_checks": [
    {
      "claim_id": "C01",
      "claim_text": "The student has limited family support and internet access.",
      "claim_type": "core",
      "claim_scope": "core",
      "support_status": "supported",
      "evidence_refs": [
        "background_context"
      ],
      "checker_source": "llm_judge",
      "rationale": "This claim is supported by the dataset, which indicates a family support flag of false and an internet access flag of false."
    },
    {
      "claim_id": "C02",
      "claim_text": "The student may require additional resources and support.",
      "claim_type": "core",
      "claim_scope": "core",
      "support_status": "supported",
      "evidence_refs": [
        "background_context"
      ],
      "checker_source": "llm_judge",
      "rationale": "The educational implications noted in the explanation align with the student's background context, indicating a need for additional support."
    }
  ],
  "errors": [],
  "holistic_rationale": "The explanation effectively summarizes the student's background context and identifies key factors impacting their academic performance. It is grounded in the provided evidence and addresses the task requirements well, with minor areas for improvement in clarity and completeness.",
  "evidence_usage_notes": "The evidence access mode was 'direct_embedding', with a full result row count of 1. The explanation utilized the complete dataset available for the student, ensuring accurate analysis."
}
