{
 "schema_version": "judge_response_schema_v1",
 "record_id": "SAMPLE_OULAD__S-T06__task_aware_data_summarization",
 "scoring_status": "scored",
 "subscores": {
 "faithfulness": {
 "applicability": "applicable",
 "score": 7,
 "rationale": "Factual interpretation was judged against the packet evidence, with penalties for unsupported scope, causality, thresholds, or direction."
 },
 "numerical_correctness": {
 "applicability": "applicable",
 "score": 8,
 "rationale": "Numeric values, percentages, rankings, thresholds, and directions were checked against the delivered or retrieved evidence in this packet."
 },
 "completeness": {
 "applicability": "applicable",
 "score": 7,
 "rationale": "Coverage was scored against the supplied core and supporting requirements for this exact task."
 },
 "task_relevance": {
 "applicability": "applicable",
 "score": 8,
 "rationale": "The score reflects whether the explanation answers the stated actionable question for the correct dataset, entity level, and audience."
 },
 "actionability": {
 "applicability": "applicable",
 "score": 7,
 "rationale": "Actionability reflects whether advice or interpretation is feasible and grounded in returned evidence or supported action provenance."
 },
 "clarity": {
 "applicability": "applicable",
 "score": 8,
 "rationale": "Clarity reflects organization, precision, concision, and whether the output is scannable for the target audience."
 },
 "safety_fairness": {
 "applicability": "applicable",
 "score": 8,
 "rationale": "Safety/fairness is applicable under the packet contract; scoring penalizes overconfident, stigmatizing, causal, or unfair individual/group framing."
 }
 },
 "claim_checks": [
 {
 "claim_id": "C01",
 "claim_text": "Summary: Your engagement has shown significant fluctuations over the weeks, indicating that you may not be studying consistently.",
 "claim_type": "task_answer",
 "claim_scope": "core",
 "support_status": "supported",
 "evidence_refs": [
 "Docs/evaluation_v2/Runs/full_208/phase13_local_taskaware/oulad_official_r5/judge_inputs/retrieval_logs/SAMPLE_OULAD__S-T06__task_aware_data_summarization.json",
 "packet.evidence_access_summary.retrieval_validation"
 ],
 "checker_source": "hybrid",
 "rationale": "The claim is consistent with the supplied packet evidence and task context."
 },
 {
 "claim_id": "C02",
 "claim_text": "While there were some weeks with higher activity, such as week 1, there were also sharp drops, particularly in week 2 and week 10, suggesting a tendency to cram rather than maintain steady study habits.",
 "claim_type": "numeric_or_status_evidence",
 "claim_scope": "core",
 "support_status": "supported",
 "evidence_refs": [
 "Docs/evaluation_v2/Runs/full_208/phase13_local_taskaware/oulad_official_r5/judge_inputs/retrieval_logs/SAMPLE_OULAD__S-T06__task_aware_data_summarization.json",
 "packet.evidence_access_summary.retrieval_validation"
 ],
 "checker_source": "hybrid",
 "rationale": "The claim is consistent with the supplied packet evidence and task context."
 },
 {
 "claim_id": "C03",
 "claim_text": "Insights: Fluctuating Engagement: Your weekly clicks varied greatly, with a peak of 98 clicks in week 1 followed by a drastic drop to just 4 clicks in week 2.",
 "claim_type": "interpretation_or_action",
 "claim_scope": "supporting",
 "support_status": "not_verifiable",
 "evidence_refs": [
 "Docs/evaluation_v2/Runs/full_208/phase13_local_taskaware/oulad_official_r5/judge_inputs/retrieval_logs/SAMPLE_OULAD__S-T06__task_aware_data_summarization.json",
 "packet.evidence_access_summary.retrieval_validation"
 ],
 "checker_source": "hybrid",
 "rationale": "The permitted evidence supports the observed pattern but not the causal or behavioral interpretation as stated.",
 "impact_type": "weakens_support"
 }
 ],
 "errors": [
 {
 "error_id": "E01",
 "error_type": "unsupported_pattern_label",
 "claim_ids": [
 "C03"
 ],
 "severity": "major",
 "primary_metric": "faithfulness",
 "secondary_metrics": [
 "task_relevance"
 ],
 "cap_candidate": 6,
 "rationale": "The explanation labels the pattern as cramming, but the packet evidence mainly proves fluctuating weekly clicks and does not fully establish intent or assessment-driven concentration.",
 "evidence_refs": [
 "Docs/evaluation_v2/Runs/full_208/phase13_local_taskaware/oulad_official_r5/judge_inputs/retrieval_logs/SAMPLE_OULAD__S-T06__task_aware_data_summarization.json",
 "packet.evidence_access_summary.retrieval_validation"
 ]
 }
 ],
 "holistic_rationale": "The record is scorable: the explanation addresses Study consistency check for student. Stronger elements are the evidence-linked values and task framing; defects, if any, concern missing qualifiers, incomplete required coverage, or over-interpretation beyond the packet. The metric pattern follows those evidence and requirement checks without calculating a final verdict.",
 "evidence_usage_notes": "evidence_access_mode was deterministic_artifact_retrieval; retrieval_log_path=Docs/evaluation_v2/Runs/full_208/phase13_local_taskaware/oulad_official_r5/judge_inputs/retrieval_logs/SAMPLE_OULAD__S-T06__task_aware_data_summarization.json; retrieved_row_count=32 with coverage=None. I used the compact packet evidence, deterministic scan summary, and retrieval validation only.",
 "invalid_reason": null
}