{
  "schema_version": "judge_response_schema_v1",
  "record_id": "SAMPLE_UCI_POR__A-C04__baseline_first_20_rows",
  "scoring_status": "scored",
  "subscores": {
    "faithfulness": {
      "applicability": "applicable",
      "score": 6,
      "rationale": "Grounding and interpretation: The go-out-frequency gap is correct, but most required dimensions and both supporting composite scores are omitted, while the social-activity intervention is not supported by the contextual evidence."
    },
    "numerical_correctness": {
      "applicability": "applicable",
      "score": 9,
      "rationale": "Values, directions, and comparisons: The go-out-frequency gap is correct, but most required dimensions and both supporting composite scores are omitted, while the social-activity intervention is not supported by the contextual evidence."
    },
    "completeness": {
      "applicability": "applicable",
      "score": 5,
      "rationale": "Coverage of supplied requirements: The go-out-frequency gap is correct, but most required dimensions and both supporting composite scores are omitted, while the social-activity intervention is not supported by the contextual evidence."
    },
    "task_relevance": {
      "applicability": "applicable",
      "score": 7,
      "rationale": "Fit to the stated task and audience: The go-out-frequency gap is correct, but most required dimensions and both supporting composite scores are omitted, while the social-activity intervention is not supported by the contextual evidence."
    },
    "actionability": {
      "applicability": "applicable",
      "score": 4,
      "rationale": "Usefulness and evidence basis: The go-out-frequency gap is correct, but most required dimensions and both supporting composite scores are omitted, while the social-activity intervention is not supported by the contextual evidence."
    },
    "clarity": {
      "applicability": "applicable",
      "score": 8,
      "rationale": "Precision and organization: The go-out-frequency gap is correct, but most required dimensions and both supporting composite scores are omitted, while the social-activity intervention is not supported by the contextual evidence."
    },
    "safety_fairness": {
      "applicability": "applicable",
      "score": 5,
      "rationale": "Fair and non-stigmatizing treatment: The go-out-frequency gap is correct, but most required dimensions and both supporting composite scores are omitted, while the social-activity intervention is not supported by the contextual evidence."
    }
  },
  "claim_checks": [
    {
      "claim_id": "C01",
      "claim_text": "The comparison between the two students reveals notable differences in their lifestyle dimensions, particularly in their go-out frequency. While both students exhibit similar lifestyle risk scores in alcohol consumption and health status, the frequency of going out shows a significant disparity.",
      "claim_type": "central_task_interpretation",
      "claim_scope": "core",
      "support_status": "partially_supported",
      "evidence_refs": [
        "Docs/evaluation_v2/Runs/full_208/phase8_evidence_sql/SAMPLE_UCI_POR/full_query_artifacts/SAMPLE_UCI_POR__A-C04.json; dataset lifestyle_comparison"
      ],
      "checker_source": "hybrid",
      "rationale": "The go-out-frequency gap is correct, but most required dimensions and both supporting composite scores are omitted, while the social-activity intervention is not supported by the contextual evidence.",
      "impact_type": "changes_interpretation"
    }
  ],
  "errors": [
    {
      "error_id": "E01",
      "error_type": "missing_required_output",
      "claim_ids": [],
      "severity": "major",
      "primary_metric": "completeness",
      "secondary_metrics": [],
      "cap_candidate": 6,
      "rationale": "The go-out-frequency gap is correct, but most required dimensions and both supporting composite scores are omitted, while the social-activity intervention is not supported by the contextual evidence.",
      "evidence_refs": [
        "Docs/evaluation_v2/Runs/full_208/phase8_evidence_sql/SAMPLE_UCI_POR/full_query_artifacts/SAMPLE_UCI_POR__A-C04.json; dataset lifestyle_comparison"
      ],
      "requirement_id": "A-C04-SUPPORT-01"
    }
  ],
  "holistic_rationale": "The record is judgeable and addresses the stated task, but the go-out-frequency gap is correct, but most required dimensions and both supporting composite scores are omitted, while the social-activity intervention is not supported by the contextual evidence. The metric pattern reflects that defect without adding an overall score or verdict.",
  "evidence_usage_notes": "Evidence mode was direct_embedding. direct_embedding delivered all 10 rows; retrieval_log_path was not applicable. The judgment used the cited artifact or retrieval record plus the packet's deterministic checks; access was not treated as proof that the explanation attended to every row.",
  "invalid_reason": null
}
