{
 "schema_version": "judge_response_schema_v1",
 "record_id": "SAMPLE_OULAD__A-C01__task_aware_data_summarization",
 "scoring_status": "scored",
 "subscores": {
 "faithfulness": {
 "applicability": "applicable",
 "score": 9,
 "rationale": "Factual interpretation was judged against the packet evidence, with penalties for unsupported scope, causality, thresholds, or direction."
 },
 "numerical_correctness": {
 "applicability": "applicable",
 "score": 9,
 "rationale": "Numeric values, percentages, rankings, thresholds, and directions were checked against the delivered or retrieved evidence in this packet."
 },
 "completeness": {
 "applicability": "applicable",
 "score": 9,
 "rationale": "Coverage was scored against the supplied core and supporting requirements for this exact task."
 },
 "task_relevance": {
 "applicability": "applicable",
 "score": 9,
 "rationale": "The score reflects whether the explanation answers the stated actionable question for the correct dataset, entity level, and audience."
 },
 "actionability": {
 "applicability": "applicable",
 "score": 8,
 "rationale": "Actionability reflects whether advice or interpretation is feasible and grounded in returned evidence or supported action provenance."
 },
 "clarity": {
 "applicability": "applicable",
 "score": 8,
 "rationale": "Clarity reflects organization, precision, concision, and whether the output is scannable for the target audience."
 },
 "safety_fairness": {
 "applicability": "applicable",
 "score": 8,
 "rationale": "Safety/fairness is applicable under the packet contract; scoring penalizes overconfident, stigmatizing, causal, or unfair individual/group framing."
 }
 },
 "claim_checks": [
 {
 "claim_id": "C01",
 "claim_text": "Summary: Only one returned student (SAMPLE_OULAD_STU_100788) is present, so between-student divergence is not estimable.",
 "claim_type": "task_answer",
 "claim_scope": "core",
 "support_status": "supported",
 "evidence_refs": [
 "packet.direct_embedded_full_query_result.datasets",
 "packet.full_run_deterministic_checks"
 ],
 "checker_source": "hybrid",
 "rationale": "The claim is consistent with the supplied packet evidence and task context."
 },
 {
 "claim_id": "C02",
 "claim_text": "At assessment_order=1, returned points are CMA score_normalized=100, TMA score_normalized=92.",
 "claim_type": "numeric_or_status_evidence",
 "claim_scope": "core",
 "support_status": "supported",
 "evidence_refs": [
 "packet.direct_embedded_full_query_result.datasets",
 "packet.full_run_deterministic_checks"
 ],
 "checker_source": "hybrid",
 "rationale": "The claim is consistent with the supplied packet evidence and task context."
 },
 {
 "claim_id": "C03",
 "claim_text": "The observed trough is assessment_order=4 TMA score_normalized=61.",
 "claim_type": "interpretation_or_action",
 "claim_scope": "supporting",
 "support_status": "supported",
 "evidence_refs": [
 "packet.direct_embedded_full_query_result.datasets",
 "packet.full_run_deterministic_checks"
 ],
 "checker_source": "hybrid",
 "rationale": "The claim is consistent with the supplied packet evidence and task context."
 }
 ],
 "errors": [],
 "holistic_rationale": "The record is scorable: the explanation addresses Compare performance trajectories for instructor. Stronger elements are the evidence-linked values and task framing; defects, if any, concern missing qualifiers, incomplete required coverage, or over-interpretation beyond the packet. The metric pattern follows those evidence and requirement checks without calculating a final verdict.",
 "evidence_usage_notes": "evidence_access_mode was direct_embedding; prompt_embedded_row_count=17; retrieval_log_path was not applicable. I used the embedded dataset rows and full-run deterministic checks only.",
 "invalid_reason": null
}
