{
  "schema_version": "judge_response_schema_v1",
  "record_id": "SAMPLE_UCI_POR__A-G06__baseline_first_20_rows",
  "scoring_status": "scored",
  "subscores": {
    "faithfulness": {
      "applicability": "applicable",
      "score": 8,
      "rationale": "Claims were judged against the permitted evidence; penalties reflect unsupported, contradicted, or overstrong interpretations when detected."
    },
    "numerical_correctness": {
      "applicability": "applicable",
      "score": 8,
      "rationale": "Numerical values, percentages, rankings, and thresholds were checked against the supplied rows and task context where present."
    },
    "completeness": {
      "applicability": "applicable",
      "score": 7,
      "rationale": "The explanation was checked against the supplied core and supporting requirements, with omissions penalized only for required outputs."
    },
    "task_relevance": {
      "applicability": "applicable",
      "score": 8,
      "rationale": "The response addresses the stated task, dataset, audience, and scope unless missing core outputs or unsupported claims weaken the target answer."
    },
    "actionability": {
      "applicability": "applicable",
      "score": 6,
      "rationale": "Recommendations or decision support were assessed for whether they follow from the record evidence and match the requested decision level."
    },
    "clarity": {
      "applicability": "applicable",
      "score": 8,
      "rationale": "The explanation is generally readable and organized; clarity score reflects precision and concision rather than factual correctness."
    },
    "safety_fairness": {
      "applicability": "applicable",
      "score": 8,
      "rationale": "Safety and fairness were treated as applicable per the conservative pilot default and checked for stigmatizing or deterministic framing."
    }
  },
  "claim_checks": [
    {
      "claim_id": "C01",
      "claim_text": "The analysis of the relationship between Resource Type and Avg Score of Users cannot be conducted due to the absence of data in the dataset.",
      "claim_type": "semantic_interpretation",
      "claim_scope": "core",
      "support_status": "supported",
      "evidence_refs": [
        "full_query_artifacts:activity_effectiveness"
      ],
      "checker_source": "hybrid",
      "rationale": "Evidence context supports limited/no usable data."
    },
    {
      "claim_id": "C02",
      "claim_text": "Without any records, no correlation patterns can be identified.",
      "claim_type": "semantic_interpretation",
      "claim_scope": "incidental",
      "support_status": "supported",
      "evidence_refs": [
        "full_query_artifacts:activity_effectiveness"
      ],
      "checker_source": "hybrid",
      "rationale": "Evidence context supports limited/no usable data."
    },
    {
      "claim_id": "C03",
      "claim_text": "No data available for analysis, making it impossible to draw any conclusions or recommendations.",
      "claim_type": "recommendation",
      "claim_scope": "supporting",
      "support_status": "supported",
      "evidence_refs": [
        "full_query_artifacts:activity_effectiveness"
      ],
      "checker_source": "hybrid",
      "rationale": "Evidence context supports limited/no usable data."
    }
  ],
  "errors": [],
  "holistic_rationale": "The explanation was scoreable and appropriately recognizes that the available evidence is empty or insufficient for the requested analysis. The central limitation is reduced completeness/actionability because the requested substantive outputs cannot be fully produced from the supplied evidence.",
  "evidence_usage_notes": "Evidence access mode was direct_embedding. Judgment used manifest-referenced artifacts for activity_effectiveness; retrieval_log_path was not applicable. Direct rows, artifact row counts, and any backend data-quality warnings materially informed claim and requirement checks.",
  "invalid_reason": null
}
