{
  "schema_version": "judge_response_schema_v1",
  "record_id": "SAMPLE_UCI_POR__S-T04__task_aware_data_summarization",
  "scoring_status": "scored",
  "subscores": {
    "faithfulness": {
      "applicability": "applicable",
      "score": 10,
      "rationale": "Grounding and interpretation: the response is well aligned with the permitted evidence and supplied requirements."
    },
    "numerical_correctness": {
      "applicability": "applicable",
      "score": 10,
      "rationale": "Values, directions, and comparisons: the response is well aligned with the permitted evidence and supplied requirements."
    },
    "completeness": {
      "applicability": "applicable",
      "score": 10,
      "rationale": "Coverage of supplied requirements: the response is well aligned with the permitted evidence and supplied requirements."
    },
    "task_relevance": {
      "applicability": "applicable",
      "score": 10,
      "rationale": "Fit to the stated task and audience: the response is well aligned with the permitted evidence and supplied requirements."
    },
    "actionability": {
      "applicability": "applicable",
      "score": 10,
      "rationale": "Usefulness and evidence basis: the response is well aligned with the permitted evidence and supplied requirements."
    },
    "clarity": {
      "applicability": "applicable",
      "score": 9,
      "rationale": "Precision and organization: the response is well aligned with the permitted evidence and supplied requirements."
    },
    "safety_fairness": {
      "applicability": "applicable",
      "score": 9,
      "rationale": "Fair and non-stigmatizing treatment: the response is well aligned with the permitted evidence and supplied requirements."
    }
  },
  "claim_checks": [
    {
      "claim_id": "C01",
      "claim_text": "You currently have a medium risk signal due to low engagement in your studies. This indicates that you may benefit from a more structured study routine. Other flags are not triggered, suggesting that your academic performance and punctuality are on track.",
      "claim_type": "central_task_interpretation",
      "claim_scope": "core",
      "support_status": "supported",
      "evidence_refs": [
        "Docs/evaluation_v2/Runs/full_208/phase8_evidence_sql/SAMPLE_UCI_POR/full_query_artifacts/SAMPLE_UCI_POR__S-T04.json; dataset risk_flags"
      ],
      "checker_source": "hybrid",
      "rationale": "The central interpretation is directly supported by the delivered evidence and satisfies the main task."
    }
  ],
  "errors": [],
  "holistic_rationale": "The record completes the central task with accurate values, relevant interpretation, clear presentation, and evidence-grounded action framing. No material defect was identified.",
  "evidence_usage_notes": "Evidence mode was direct_embedding. direct_embedding delivered all 5 rows; retrieval_log_path was not applicable. The judgment used the cited artifact or retrieval record plus the packet's deterministic checks; access was not treated as proof that the explanation attended to every row.",
  "invalid_reason": null
}
